{
  "schemaVersion": "1.0",
  "buildConfig": {
    "GOOS": "linux",
    "GOARCH": "amd64",
    "CGO_ENABLED": false,
    "buildTags": [],
    "moduleRoot": "evaluation/miniflux",
    "workspaceMode": "single-module",
    "tests": false,
    "dependencyManifest": []
  },
  "analysis": {
    "algorithm": "ssa-rta-stub",
    "precisionTriggers": ["postgres-external-state"],
    "deterministic": true
  },
  "pragma": {
    "name": "feed-processor",
    "surface": "function",
    "span": {
      "file_relative_path": "internal/reader/processor/processor.go",
      "byte_offset_start": 0,
      "byte_offset_end": 1,
      "line_start": 1,
      "line_end": 1
    },
    "options": {
      "state": "external",
      "verdict": "accept"
    }
  },
  "root": {
    "identity": {
      "module_path": "miniflux.app/v2",
      "package_path": "miniflux.app/v2/internal/reader/processor",
      "object_name": "ProcessFeedEntries",
      "kind": "function"
    },
    "registryKey": null,
    "exposedOperations": [
      {
        "module_path": "miniflux.app/v2",
        "package_path": "miniflux.app/v2/internal/reader/processor",
        "object_name": "ProcessFeedEntries",
        "kind": "function"
      }
    ]
  },
  "closure": {
    "includedSymbols": [],
    "excludedSymbols": [],
    "wiringPaths": []
  },
  "state": [
    {
      "symbol": {
        "module_path": "miniflux.app/v2",
        "package_path": "miniflux.app/v2/internal/storage",
        "object_name": "Store",
        "kind": "type"
      },
      "classes": ["externalized-durable"],
      "disposition": "replicated",
      "evidence": ["Postgres connection is already external"],
      "developerDeclared": true
    }
  ],
  "adapters": [
    {
      "kind": "serialization",
      "id": "http-json-function",
      "matchedSymbols": [
        {
          "module_path": "miniflux.app/v2",
          "package_path": "miniflux.app/v2/internal/reader/processor",
          "object_name": "ProcessFeedEntries",
          "kind": "function"
        }
      ],
      "canonicalShapes": ["context-plus-json"],
      "stateEffects": ["externalized-durable"],
      "transportEffects": ["http-json"],
      "serializationEffects": ["json"]
    }
  ],
  "externalDependencies": [
    {
      "identity": {
        "module_path": "github.com/lib/pq",
        "package_path": "github.com/lib/pq",
        "object_name": "postgres",
        "kind": "package"
      },
      "accessPath": "postgres://miniflux@postgres:5432/miniflux",
      "configurationSource": "env:DATABASE_URL",
      "stateEffectSummary": ["externalized-durable"]
    }
  ],
  "pruning": {
    "bounded": true,
    "frontier": []
  },
  "diagnostics": []
}
